,comment,course_id,ratio
4338,A great course that has completely changed my perception towards software design with the course USABLE SECURITY. The materials and lecture videos are nothing but wonderful. I really had a great time while learning. Thanks,dPkbnh6zEeWP0w4yK2369w,0.6842105263157895
4339,Informative and practical use of Security design,dPkbnh6zEeWP0w4yK2369w,1.0
4340,Great course!,dPkbnh6zEeWP0w4yK2369w,0.6666666666666666
4341,W,dPkbnh6zEeWP0w4yK2369w,1.0
4342,V,dPkbnh6zEeWP0w4yK2369w,1.0
4343,Nice course,dPkbnh6zEeWP0w4yK2369w,1.0
4344,Very Good course,dPkbnh6zEeWP0w4yK2369w,1.0
4345,I did not learn a lot. ,dPkbnh6zEeWP0w4yK2369w,0.8571428571428571
4346,Great education program for usable security ,dPkbnh6zEeWP0w4yK2369w,1.0
4347,"Instructor was easy to follow, made clear points with today's technology examples and kept me engaged during my time.",dPkbnh6zEeWP0w4yK2369w,0.7826086956521741
4348,Great,dPkbnh6zEeWP0w4yK2369w,1.0
4349,Very good course.. I learned much!Thank you for this opportunities,dPkbnh6zEeWP0w4yK2369w,0.7692307692307693
4350,"Helps reform UNIX and C lovers, let's not be the BOFH and make usable systems for our users!",dPkbnh6zEeWP0w4yK2369w,0.5454545454545454
4351,Useful concepts. Quite simple.,dPkbnh6zEeWP0w4yK2369w,0.5
4352,Excellent course. A must for every software architect of any software that has human interaction.,dPkbnh6zEeWP0w4yK2369w,0.7058823529411765
4353,Bad sound quality,dPkbnh6zEeWP0w4yK2369w,1.0
4354,"I sincerely enjoyed this course. The instructor was clear, concise, and obviously passionate about the subject matter. I appreciate that reading materials were complimentary to the videos. I can say I actually walked away with information I can apply to my career. I gained a new perspective about usability testing and implementation that I will be employing in my network authentication practices and policy development.",dPkbnh6zEeWP0w4yK2369w,0.5972222222222222
4355,thanks for the lectures. the best so farvery informative. never knew system designers have to go through a lot to make it usable. wow now am a system designer ,dPkbnh6zEeWP0w4yK2369w,0.6875
4356,amazing course and i would recommend it for others for sure,dPkbnh6zEeWP0w4yK2369w,0.8181818181818182
4357,If there were some Powerpoint slides in the course memorising would have been easier. Thanks a lot.,dPkbnh6zEeWP0w4yK2369w,0.7368421052631579
4358,Good Course. But has many generic stuffs. We will get to know about most of the security details that we come across our day today life,dPkbnh6zEeWP0w4yK2369w,0.7857142857142857
4359,Excellent introductory course for increasing your usability and security in soft,dPkbnh6zEeWP0w4yK2369w,1.0
4360,Great course!Very interesting and very ingaging content I would go so far as to say very usable .,dPkbnh6zEeWP0w4yK2369w,0.75
4361,Is an excellent course.,dPkbnh6zEeWP0w4yK2369w,0.8
4362,Great course! Very intriguing insights regarding security. So many of my 'myths' got busted.,dPkbnh6zEeWP0w4yK2369w,0.631578947368421
4363,It was really good on content part. I really like the course material. It is going to help me in my current organization project development work. At the same time i want to explore other available courses on cyber security.,dPkbnh6zEeWP0w4yK2369w,0.7272727272727273
4364,"I love this course, I have learn a lot!",dPkbnh6zEeWP0w4yK2369w,0.7272727272727273
4365,"I've learned a lot in this course about usability. It focuses more on the user and creating a system that works best for the user, rather than the designer. I've also learned how to create better passwords that are more secure and user-friendly. I would recommend this course to anyone.",dPkbnh6zEeWP0w4yK2369w,0.5573770491803278
4366,I think this course was worth taking an I thoroughly enjoyed through every bit of the lessons.,dPkbnh6zEeWP0w4yK2369w,0.7777777777777778
4367,this course helped me to understand designing and usability,dPkbnh6zEeWP0w4yK2369w,0.8888888888888888
4368,"A totally new insights to security. Since I am a Software Engineer student this concepts are going to prove invaluable in my future tasks. Great tutor and Coursera support, love it.",dPkbnh6zEeWP0w4yK2369w,0.6857142857142857
4369,"This course have very little to do with actual security. Most of the time you will hear about how to design applications, and what is a good design policy.",dPkbnh6zEeWP0w4yK2369w,0.8125
4370,"Very excellent course module for usable security, real time examples makes students understand easily.",dPkbnh6zEeWP0w4yK2369w,0.6875
4371,It is one course which should done by each and every one who is using the computer as it talks about daily security problems and this course will let every one aware about how to keep there password and at what duration User should Change there password to keep there System Secure.,dPkbnh6zEeWP0w4yK2369w,0.6415094339622641
4372,"I like it, but i feel that sometimes need more examples o dynamic",dPkbnh6zEeWP0w4yK2369w,0.7857142857142857
4373,Great insight about security and security system design.,dPkbnh6zEeWP0w4yK2369w,0.7777777777777778
4374,Excellent Course. ,dPkbnh6zEeWP0w4yK2369w,0.6666666666666666
4375,Found it very useful. The content is articulated very well and is substantiated with research work &amp; survey. This gives me a way to objectively assess system from security point of view,dPkbnh6zEeWP0w4yK2369w,0.75
4376,Very useful content that can be used in our workplaces,dPkbnh6zEeWP0w4yK2369w,0.9
4377,"Great exposition of didactic and interactive readings and materials. I was not dissappointed, and as the course advanced, so did the difficulty, i happenned to have a base on the subject, but it was an enjoyable and sometimes funny learning experience.",dPkbnh6zEeWP0w4yK2369w,0.6382978723404256
4378,Good interesting course. Good lecturer. But course shoud covet more information because it's a little bit easy. ,dPkbnh6zEeWP0w4yK2369w,0.6818181818181818
4379,"This is a basic overview of security issues and user input for web sites, etc. It focuses on design, usability and other issues that affect how people interact with security log-in and other issues.It's a good foundation for looking at your or other's work and knowing the best way for the computer to interact with a user. ",dPkbnh6zEeWP0w4yK2369w,0.5652173913043478
4380,"this course is cool but not hard enough i think, it should cover more materials and it should be harder. ",dPkbnh6zEeWP0w4yK2369w,0.7727272727272727
4381,"I think this was a very well-thought out course. In my opinion, it was well presented, contained very useful information, was accessible to someone with a limited background in cybersecurity, and used plenty of real examples to back-up its claims. An area that could use improvement is testing some of the quizzes provided questions that seemed hard to follow, particularly the choose ",dPkbnh6zEeWP0w4yK2369w,0.6164383561643836
4382,Interesting topics and some very good case studies. But overall I found the course a little repetitive and lacking technical depth.,dPkbnh6zEeWP0w4yK2369w,0.7391304347826086
4383,"Good introduction to the general security of UX design and experience. Remember this is just the start. Not too technical or difficult, quite easy to be honest. ",dPkbnh6zEeWP0w4yK2369w,0.7741935483870968
4384," Despite not being very fond of areas such as human-computer interaction, I found this course to be well-presented and useful. Definitely a necessity for anyone planning on building secure software. ",dPkbnh6zEeWP0w4yK2369w,0.7297297297297297
4385,"Great course, with really well-explained and interesting classes. A minor problem was the audio issues, but nothing that would hinder your learning.",dPkbnh6zEeWP0w4yK2369w,0.75
4386,Informative and the reading material for the week helped a lot ,dPkbnh6zEeWP0w4yK2369w,0.8181818181818182
4387,"I'm not a cyber professional, but I deal with a lot of security issues just as a part of the job. I'm also researching new hardware methods for cyber security systems. I found aspects of this course to be useful to me. Enjoyed the ",dPkbnh6zEeWP0w4yK2369w,0.5192307692307693
4388,I really learned so much from this course,dPkbnh6zEeWP0w4yK2369w,1.0
4389,Very interesting and a different approach to make security acceptable to users. Currnet technology allow that,dPkbnh6zEeWP0w4yK2369w,0.7647058823529411
4390,Clear and professional!,dPkbnh6zEeWP0w4yK2369w,0.75
4391,Very informative! ,dPkbnh6zEeWP0w4yK2369w,0.6666666666666666
4392,A really good course in usable security. A little more of assignments would have been better,dPkbnh6zEeWP0w4yK2369w,0.8235294117647058
4393,Very good need more good content like this. ,dPkbnh6zEeWP0w4yK2369w,0.7777777777777778
4394,"Very clear and organized, I will certainly make use of what I learned when writing programs or designing software.",dPkbnh6zEeWP0w4yK2369w,0.7619047619047619
4395,Great course and interesting. ,dPkbnh6zEeWP0w4yK2369w,0.8
4396,"iTS Okay. a few things seem a bit hokey. the interviews etc. But overall, not too bad. Good learning points.But will I pay for this. NO. Mainly b c its hard to translate it in to a tangible value. No employer will say, OH, you took this class. Let me give you a job or promotion or more money...",dPkbnh6zEeWP0w4yK2369w,0.6027397260273972
4397,"Videos with guest speakers were unhelpful. Also, quizzes were not accurate and poorly written questions. ",dPkbnh6zEeWP0w4yK2369w,0.5555555555555556
4398,"very helpful course , and it is help us to improve our knowledge and skills ",dPkbnh6zEeWP0w4yK2369w,0.8
4399,"Thank you! I have learned a lot through the course, in a fun and easy way. ",dPkbnh6zEeWP0w4yK2369w,0.7894736842105263
4400,"OK, but not really in-depth. Still has useful pointers, but they could be summarized on an A4 sheet.",dPkbnh6zEeWP0w4yK2369w,0.5416666666666666
4401,"Awesome. I am genuinely exited that I actually took and finished this course. Great content, actionable and at some moments, eye opener.I totally recommend it.",dPkbnh6zEeWP0w4yK2369w,0.65625
4402,Great course with a easy way yo learn about Usable Security.,dPkbnh6zEeWP0w4yK2369w,0.9166666666666666
4403,Excellent and useful lecture,dPkbnh6zEeWP0w4yK2369w,1.0
