,comment,course_id,ratio
447,"Overall, I enjoyed this course. Especially from week 1 to 3 where the course contents were simply amazing.It would be great if week 4 and 5 can engage the students like week 1 to 3, and the forum can be more alive.Thank you.",NwQ9txnoEeWDtQoum3sFeQ,0.5490196078431373
448,"This is a really useful course. The project is quite relevant, and the work with breadth first search, Dijkstra, and A Search are really interesting!",NwQ9txnoEeWDtQoum3sFeQ,0.6
449,Challenging class and well-designed course for intermediate Java programmers.,NwQ9txnoEeWDtQoum3sFeQ,0.5833333333333334
450,Excellent course!,NwQ9txnoEeWDtQoum3sFeQ,0.6666666666666666
451,This course was excellent! I learned so much and I am now able to understand the significance of knowing how Algorithms and Data Structures are related in a practical way. I,NwQ9txnoEeWDtQoum3sFeQ,0.7878787878787878
452,The last 2 lessons did not have much content. Particularly there was no practical assessment on traveling salesman,NwQ9txnoEeWDtQoum3sFeQ,0.8421052631578947
453,Nice course!,NwQ9txnoEeWDtQoum3sFeQ,0.6666666666666666
454,Fantastic Course,NwQ9txnoEeWDtQoum3sFeQ,1.0
455,"It would be very, very beneficial if maybe one or two more videos were added to dive in-depth into ADTs and their method callback run-time analysis. Aside from that this class was educational and interesting as expected.",NwQ9txnoEeWDtQoum3sFeQ,0.75
456,Very nice course for clearing the concept of the advanced search algorithm and applying them in the real world scenario. Well designed course and programming materials. ,NwQ9txnoEeWDtQoum3sFeQ,0.6785714285714286
457,Wonderful Course. This has very good explanation of Data Structures,NwQ9txnoEeWDtQoum3sFeQ,0.7272727272727273
458,great course ,NwQ9txnoEeWDtQoum3sFeQ,1.0
459,"its hard, but intresting",NwQ9txnoEeWDtQoum3sFeQ,0.6
460, Very interesting and adaptative for the student as you can catch another later session.I found there's a huge gap between week1 and week2.Thanks ,NwQ9txnoEeWDtQoum3sFeQ,0.7931034482758621
461, Good course! ,NwQ9txnoEeWDtQoum3sFeQ,0.6666666666666666
462,"Good course. The example application is fun looking at graph data structures as part of route planning in a Google Maps based app - and there is room to experiment. I continue to enjoy the instructors, who present well and have obviously done a good job preparing the material. Much fun!",NwQ9txnoEeWDtQoum3sFeQ,0.625
463,Now i understand how gps planing routes work! I really like Data Structures and the importance of Graphs,NwQ9txnoEeWDtQoum3sFeQ,0.631578947368421
464,"Loved it. Once again the skeleton code provided and course material was great. It was once again introducing new concepts which were never part of BASIC, FORTRAN or DELPHI. So I enjoyed the pain of having to get my head around the objects and code.Thanks !!!!",NwQ9txnoEeWDtQoum3sFeQ,0.5576923076923077
465,I understood about graphs from here at last after trying various resources online but peace was attained here in this course,NwQ9txnoEeWDtQoum3sFeQ,0.7619047619047619
466,I give really high marks for this course as the graphs are presented in a proper and practical manner. I have a suggestion to present the High Level of Graphs more in the area of Information theory. Otherwise it is nice approach and very good implementation of the material and exams.,NwQ9txnoEeWDtQoum3sFeQ,0.6481481481481481
467,"awesome course , gave me lot of confidence thanks a lot ",NwQ9txnoEeWDtQoum3sFeQ,0.8181818181818182
468,"The course content and presentation was excellent. I love the large-project format of the classes in this specialization. I only wish this course had more resources for working offline, at a level that matches the previous courses in the specialization. ",NwQ9txnoEeWDtQoum3sFeQ,0.6086956521739131
469,This is an awesome course with great stuff for learning and practical graphs concept in programming with some useful algorithms like A . ,NwQ9txnoEeWDtQoum3sFeQ,0.7826086956521741
470,Great course!,NwQ9txnoEeWDtQoum3sFeQ,0.6666666666666666
471,Introduction to data structures. It wastes a week talking about theoretical complexity when it could have been used for something more productive.,NwQ9txnoEeWDtQoum3sFeQ,0.7916666666666666
472,Exciting algorithm application in path-finding and routing.,NwQ9txnoEeWDtQoum3sFeQ,0.8
473,Best classes I ever took till now. This really enhanced my Java programming skills. Thank you.,NwQ9txnoEeWDtQoum3sFeQ,0.6842105263157895
474,Thanks for sharing the knowledge.this course was awesome,NwQ9txnoEeWDtQoum3sFeQ,0.8
475,I have really enjoyed this!,NwQ9txnoEeWDtQoum3sFeQ,0.6666666666666666
476,Very interesting and challenging,NwQ9txnoEeWDtQoum3sFeQ,0.75
477,"The contents were pretty basic for me, but they were presented clearly. All in all I liked the review this course gave me.",NwQ9txnoEeWDtQoum3sFeQ,0.6538461538461539
478,Very good series for learning Java and OO Principles. The big application approach is very interesting as we can see the whole picture even when we know little yet. The interviews with software engineers are very enlightening.This particular installment has the animation of the shortest path algorithm on the map and that's very helpful to fully understand the amount of work and the effects of optimizations in different shortest path approaches.,NwQ9txnoEeWDtQoum3sFeQ,0.5897435897435898
479,great course thanks!,NwQ9txnoEeWDtQoum3sFeQ,0.75
480,"The course is well-laid and very interesting. Even though the material is pretty difficult and advanced. As always the great talent of Christine, Mia and Leo is beyond praise. I definitely recommend this course for developers who want to improve their mastery. Many thanks for the brilliant course.",NwQ9txnoEeWDtQoum3sFeQ,0.625
481,well structured! I learnt a lot.,NwQ9txnoEeWDtQoum3sFeQ,0.75
482,"What I really enjoyed in this course was to discover how to represent streets and intersections and finally trace a path from a starting point to a destination, like a GPS! Really nice!",NwQ9txnoEeWDtQoum3sFeQ,0.6388888888888888
483,As all their courses this one is great!,NwQ9txnoEeWDtQoum3sFeQ,0.7777777777777778
484,Awesome course!,NwQ9txnoEeWDtQoum3sFeQ,0.6666666666666666
485,Graphs now are more interesting and useful!,NwQ9txnoEeWDtQoum3sFeQ,0.75
486,Excellent specialization,NwQ9txnoEeWDtQoum3sFeQ,1.0
487,Teach you the basic of graph,NwQ9txnoEeWDtQoum3sFeQ,1.0
488,Nice course.,NwQ9txnoEeWDtQoum3sFeQ,0.6666666666666666
489,Thanks a lot! Very interesting course!,NwQ9txnoEeWDtQoum3sFeQ,0.75
490,Nice one!!,NwQ9txnoEeWDtQoum3sFeQ,0.6666666666666666
491,"At first the course is hands on, later on it becomes more of theory. This would have been a challenging course if we had more harder graph problems to solve though.",NwQ9txnoEeWDtQoum3sFeQ,0.7352941176470589
492,Amazing beginner course to learn about the Graph data structure.,NwQ9txnoEeWDtQoum3sFeQ,0.9090909090909092
493,"Great courser, challenging assignment, but learnt a lot",NwQ9txnoEeWDtQoum3sFeQ,0.7
494,In Depth Course..,NwQ9txnoEeWDtQoum3sFeQ,0.75
495,Nice concrete course to take. Good info about graphs as a whole. Enjoyed it. ,NwQ9txnoEeWDtQoum3sFeQ,0.6470588235294118
496,Good use of data structures.,NwQ9txnoEeWDtQoum3sFeQ,0.6666666666666666
497,Great course.,NwQ9txnoEeWDtQoum3sFeQ,0.6666666666666666
498,"The course is really way to easy. It could be done all in one day, definitely not worth 80$. ",NwQ9txnoEeWDtQoum3sFeQ,0.8181818181818182
499,"Challenging and fun. So glad I took this course. Made some cool changes for the extension, but I'll keep working on it just for fun!",NwQ9txnoEeWDtQoum3sFeQ,0.6451612903225806
500,good course on Graph ,NwQ9txnoEeWDtQoum3sFeQ,1.0
501,Course was well paced. Assignments were relevant. Only shortcoming I believe was that the last two weeks of the course did not require any submission of a coding assignment. Only required a quiz. I feel that the course would benefit from a requirement to submit some code each week.,NwQ9txnoEeWDtQoum3sFeQ,0.6296296296296297
502,This was a very useful course which covered the main fundamental aspects of graphs in Java. The assignments were very interesting and challenging as well. The lecture videos provided all the information in a very detailed manner. There was nothing more I could ask for. Overall it was a great experience!!,NwQ9txnoEeWDtQoum3sFeQ,0.625
503,"As 2 previous courses of this specialization - the authors did a great job! I really enjoy it and learn a lot of things. The workload is perfect not too much, so you can get things done on time, but still pretty informative and intense. The way the material is presented is beyond all expectations. I really recommend this specialization to anybody looking for a good course of algorithms in Java. ",NwQ9txnoEeWDtQoum3sFeQ,0.5897435897435898
504,Really coool,NwQ9txnoEeWDtQoum3sFeQ,0.5
505,"Interesting things about graph algos, but I think the content should be more challengingEspecially the last two weeks, a quick quizz and a free assignment the automatically give full grade whatever the content",NwQ9txnoEeWDtQoum3sFeQ,0.6571428571428571
506,Thank you. Very interesting course.,NwQ9txnoEeWDtQoum3sFeQ,0.7142857142857143
507,interesting project.,NwQ9txnoEeWDtQoum3sFeQ,0.6666666666666666
508,"Good course to build confidence in building a class from scratch. But, I expected more from this course. A few lectures could have been devoted to popular design patterns used in Graph problems maybe.One more assignment to actually make the students work on heuristics for solving NP-Hard problems would have been helpful.",NwQ9txnoEeWDtQoum3sFeQ,0.6
509,"Wonderful course, I will never forget the Santa example used to describe the Traveling Sales Man problem. Absolutely love all the instructors.",NwQ9txnoEeWDtQoum3sFeQ,0.68
510,"A few more graph algorithms and their implementations, if added to the course, would be nice.",NwQ9txnoEeWDtQoum3sFeQ,0.7368421052631579
511,"This course was very well put together. The videos were clear and well organized. They typically contained a powerpoint presentation and little box with the presenter's head. The assignments built off of each other by reusing code from previous weeks. The test cases for the grader weren't very complete. If I have any recommendations for the organizers it would be to tighten up their grading process. For one assignment, I completely forgot to write one function and there was no test coverage for it! I ended up writing it the next week. Still the codebase that they have provided for the class is large so I don't fault them for bugs. I think it will probably improve over time as more people take the course. Overall, they did a great job!",NwQ9txnoEeWDtQoum3sFeQ,0.5666666666666667
512,Good,NwQ9txnoEeWDtQoum3sFeQ,1.0
513,Splendidly covers path finding basics. Enjoyed the course.It would be great to go into advanced algorithms useful for programming challenges like SPOJ with the same instructors.,NwQ9txnoEeWDtQoum3sFeQ,0.6
514,Amazing!,NwQ9txnoEeWDtQoum3sFeQ,0.5
515,"Excellent course, if a little short. the instructors did a really good job of explaining the concepts.",NwQ9txnoEeWDtQoum3sFeQ,0.65
516,Felt like it was a bit rushed and some of these concepts like Dijkstra definitely deserve a lot more attention.,NwQ9txnoEeWDtQoum3sFeQ,0.7619047619047619
517,"Very interesting programming assignment for the BFS, Dijkstra and A methods. Great job with that.The coverage of the TSP was weak -- room for improvement there. Perhaps include a programming assignment.Overall, the course was a worthwhile investment of time.",NwQ9txnoEeWDtQoum3sFeQ,0.5
