,comment,course_id,ratio
1265,It's a great course! The assignment is amazing! It takes me several hours or even one or two days to finish it. I have to say the assignment is really valuable. Professor Brook is also great and the video is greatly filmed. It's worth taking if you have already learned some of python and want to know more about python in data analysis. I have already learned the book Learn Python the Hard Way and played with python for a while before I take this course. ,RZ1S0B0MEeacvQ6cODzg5Q,0.567010309278
1266,Very helpful for beginners who wants to learn Data Science with Python. Will recommend to go with this course. Thank you team for giving nice teaching. Very Grateful :),RZ1S0B0MEeacvQ6cODzg5Q,0.6875
1267,Perfect to get hands on with python programming for data science purposes.,RZ1S0B0MEeacvQ6cODzg5Q,0.692307692308
1268,"Challenging assignments, clear and concise explanations, learned a ton!",RZ1S0B0MEeacvQ6cODzg5Q,0.5
1269,great,RZ1S0B0MEeacvQ6cODzg5Q,1.0
1270,"This is an amazing course. The teacher (Chris) is fantastic, extremely clear and a pleasure to listen his classes.",RZ1S0B0MEeacvQ6cODzg5Q,0.708333333333
1271,Great course. You should really work hard to pass all the assignments. Tons of practical expirience in pandas. Looking forward for the next courses.,RZ1S0B0MEeacvQ6cODzg5Q,0.642857142857
1272,Fantastic course. Quite challenging but it is really worth for people looking to learn python and some of the key concepts in data science. I definitely will continue with the following python courses part of the specialization,RZ1S0B0MEeacvQ6cODzg5Q,0.769230769231
1273,Good intro to Pandas and assignments are well designed,RZ1S0B0MEeacvQ6cODzg5Q,0.666666666667
1274,Good lecturers and interactive videos ,RZ1S0B0MEeacvQ6cODzg5Q,0.6
1275,"While the course was great, the Jupyter notebooks and the background shells gave me several unnecessary errors. While this was a smaller issue, I think the practice Notebooks should be somewhat in line with the assignments. I struggles on Assignment #3. ",RZ1S0B0MEeacvQ6cODzg5Q,0.553191489362
1276,"It is an interesting course. After taking this course, I can make use of Pandas, numpy in python. In addition, I have learned some interesting knowledge about statistic. Thanks Prof. Christopher Brooks and TAs. ",RZ1S0B0MEeacvQ6cODzg5Q,0.595238095238
1277,"Very good class - but it does require quite a bit of outside study - reading up on stackoverflow. But after this class, the student will be able to have a very hand set of tools/skills to tackle datascience projects. BTW, python with the interactive notebook is very popular in actual datascience projects in the commercial sphere, so this class can be leveraged directly in the real world",RZ1S0B0MEeacvQ6cODzg5Q,0.573333333333
1278,Great introduction to Pandas.,RZ1S0B0MEeacvQ6cODzg5Q,0.6
1279,This course was fast paced but the material was interesting and not to complex. I can only recommend this course to anyone interested in Data Science and who already has a basic knowledge of Python.,RZ1S0B0MEeacvQ6cODzg5Q,0.783783783784
1280,"The course was structured well, there were a lot of assignments that really help with learning pandas. The lectures were ok, could've been a bit longer though.",RZ1S0B0MEeacvQ6cODzg5Q,0.606060606061
1281,Best course to learn Pandas library and some basics of Python required for Data Sciences and Machine Learning.,RZ1S0B0MEeacvQ6cODzg5Q,0.684210526316
1282,Awesome introduction.,RZ1S0B0MEeacvQ6cODzg5Q,0.666666666667
1283,"I took sometime to get used to the auto grader, but after that it's fine. All the staffs are very helpful in clarifying the questions and provide code to debug my codes. It was awesome!",RZ1S0B0MEeacvQ6cODzg5Q,0.634146341463
1284,"Really amazing course, I leaned a lot about pandas, how to manage and clean data and extract value out of that. I've learned a little about statistics, specially hypothesis testing.",RZ1S0B0MEeacvQ6cODzg5Q,0.648648648649
1285,Very good and practical course. Challenging and enjoyable assessments. Thank you very much indeed. ,RZ1S0B0MEeacvQ6cODzg5Q,0.588235294118
1286,"The course is very good and very demanding. But the assignments estimation time were, for me, really completely out. I used much more than 3 more times the suggested ones.",RZ1S0B0MEeacvQ6cODzg5Q,0.628571428571
1287,The course's content is great but the fact that we have to search by our self's for the tests was the best for me.,RZ1S0B0MEeacvQ6cODzg5Q,0.689655172414
1288,"Great Course! I learn a lot about Python, Pandas and other areas. Looking forward to taking the next courses.",RZ1S0B0MEeacvQ6cODzg5Q,0.695652173913
1289,Nice course. I really liked how I could proceed at my own pace. The computer-graded assignments were very helpful and the Forums were good sources of info.,RZ1S0B0MEeacvQ6cODzg5Q,0.625
1290,"This course has greatly helped my understanding of not only some python, but pandas as well. My only suggestion to anyone that wants to take this course is to make sure to allocate as much time as possible to it. They give estimates as to how long it should take you to complete a week's worth of material, but this can vary highly from person to person. Overall, I enjoyed!",RZ1S0B0MEeacvQ6cODzg5Q,0.569620253165
1291,"Challenging, awesome. Working through the assignments will really teach you Pandas, which makes Python scripts much more efficient. I'm already using the things I have learned at work.",RZ1S0B0MEeacvQ6cODzg5Q,0.571428571429
1292,"Course lectures were good, tho at times a little too rapid. The python text appears and disappears too fast to digest, I did a lot of pausing. The early exercises were good, but later ones were finicky. I would prefer more intermediate steps to confirm we're on the right track. In particular the last (huge) exercise was frustrating, just being told I've got it wrong with no feedback on why. ",RZ1S0B0MEeacvQ6cODzg5Q,0.588235294118
1293,"This course would be great if you are experienced in Python or any other programming language. The title ' Beginner Specialization. No prior experience required.' is very misleading and if you do not have any experience, you will struggle a lot especially to complete week 3 &amp; 4 assignments. It makes you think and requires a lot of self-study, which is a good way to enhance our knowledge and skills, however assignments are way too challenging for those who are 'beginners' or have little real-world experience. I would not recommend if you do not have much confidence in your programming 'experience'.Having said that, teaching team is great - very knowledgeable and supportive. ",RZ1S0B0MEeacvQ6cODzg5Q,0.503759398496
1294,I would recommend the coursera online training session need more improvement. Please look at this youtube video. this will give you some fair idea what do i mean. https://www.youtube.com/watch?v=V0AWyzVMf54During the session speaker need to be visible on top corner and they need to present with more examples during learning this will help and learn fast. I struggled a bit following your videos going back-and-forth with the given materials.I also struggled solving the assignment due to confusing questions. Not much clear what is required to solve the problem. it would be helpful to provide some hints for each assignment. ,RZ1S0B0MEeacvQ6cODzg5Q,0.512195121951
1295,"Assignment 3 was absolutely ridiculous in the sense that the implementation of pandas functions depended on data cleaning in the first step for which there was no help . No response from peers or moderators on my queries. Had high hopes when I joined the course. I feel cheated now. Because of some issues with the data cleaning step, all my following answers were incorrect and I couldn't pass the course in time.",RZ1S0B0MEeacvQ6cODzg5Q,0.525
1296,Fantastic overview and support ,RZ1S0B0MEeacvQ6cODzg5Q,1.0
1297,"Overall this was a great class. The programming assignments were the most valuable part of the course for me and were good practice for wrangling data with pandas. I did find some of the assignments asked questions in a way that were confusing and it was difficult to debug the answer based on the automatic grader. However, I'm looking forward to when the rest of the specialization is available, as this looks like a good track!",RZ1S0B0MEeacvQ6cODzg5Q,0.559523809524
1298,Very Useful and practical,RZ1S0B0MEeacvQ6cODzg5Q,1.0
1299,"The course is very good to introduce people with pandas usage, however, the autograder and little data issues on the assignments costs a lot of learning time.",RZ1S0B0MEeacvQ6cODzg5Q,0.666666666667
1300,"In my humble opinion, the Python ramp-up in week 1 is not sufficient to effectively complete weeks 2-4. This course necessitates a bit more practice in Python. The lectures are cut-and-dry, and I recommend frequently referencing them when completing the assignments. I spent about 1.5x the listed time-to-complete on most assignments. On the flip side, I gained a lot of knowledge by putting forth full effort.",RZ1S0B0MEeacvQ6cODzg5Q,0.511363636364
1301,Very good content. Challenging assignment that force you to learn more yourself rather than just apply what you've heard and forget it in 10 minutes. ,RZ1S0B0MEeacvQ6cODzg5Q,0.689655172414
1302,Please make longer tutorial videos. Sometimes it becomes too fast to cope up with.,RZ1S0B0MEeacvQ6cODzg5Q,0.8125
1303,great course!!,RZ1S0B0MEeacvQ6cODzg5Q,0.666666666667
1304,"The course is great and learned a lot from the assignment! I just feel some of the content is a little beyond me since it took a lot of time to finish. After finishing the assignment, I feel myself haven't done enough! So if possible, I hope more exercise can be posted here :)",RZ1S0B0MEeacvQ6cODzg5Q,0.688524590164
1305,Nice course for understanding the basics,RZ1S0B0MEeacvQ6cODzg5Q,0.833333333333
1306,"Course is very self-directed. There are very few exercises, and there is minimal feedback on those exercises. No attempt is made to reinforce learned knowledge over time (e.g. spaced repetition) nor is there any definitive list for what knowledge should be gleaned from this course. Emphasis is placed on the student's teaching themselves and learning through experience with no attempt to actually understand the learning process or rest the course design on a scientific basis. Standard filler course for an empty education system.",RZ1S0B0MEeacvQ6cODzg5Q,0.622448979592
1307,Overall a very nice introduction to Python. Sometimes the checks for the assignments were a little annoying. It would be way easier if all the checks would be published from the outset.,RZ1S0B0MEeacvQ6cODzg5Q,0.628571428571
1308,"Congratulations, folks! This course is amazing! I learned *a lot* on it! =]",RZ1S0B0MEeacvQ6cODzg5Q,0.526315789474
1309,Excellent material.,RZ1S0B0MEeacvQ6cODzg5Q,0.666666666667
1310,Course is good. I learned a lot. But the pace of teaching is very fast.,RZ1S0B0MEeacvQ6cODzg5Q,0.777777777778
1311,Assignment time estimations were way off in my opinion.,RZ1S0B0MEeacvQ6cODzg5Q,0.8
1312,Thank you once again Courser and Team for their generous contribution towards students across globe. The teachers and courses mentors specially Sophie who was awesome during the assignment for her nice clarification. This course was challenging but fun. ,RZ1S0B0MEeacvQ6cODzg5Q,0.682926829268
1313,Don't think this should be classified as Beginner Specialization. No prior experience required. Need at least some coding experience. ,RZ1S0B0MEeacvQ6cODzg5Q,0.708333333333
1314,"Very well structured course. I would really appreciate if there are more video lectures. For someone like who is not from CS background, self-study topics can get really difficult.Apart from that loved it.",RZ1S0B0MEeacvQ6cODzg5Q,0.707317073171
1315,Great course for beginner in data science,RZ1S0B0MEeacvQ6cODzg5Q,1.0
1316,"please provide the complete 5 unit details . I could see only this unit is open for past many months. I paid for all 5 unit money already and not in a position revert back and get the money. Could you please help me out to understand when this courses will be available if not in near future , why are they taken money before the course is not ready to us. Quite disappointing experience.",RZ1S0B0MEeacvQ6cODzg5Q,0.620253164557
1317,Hard to do,RZ1S0B0MEeacvQ6cODzg5Q,1.0
1318,"Very rewarding course. As many others have mentioned, the learning curve in the assignments is steep and the time estimate of 4 hours/week is unrealistically short. It took me about three days of full-time work to finish the course. Great into to working with data structures in pandas, data cleaning and basic statistical tests in python.",RZ1S0B0MEeacvQ6cODzg5Q,0.560606060606
1319,Was good but the support in the forums could be better.,RZ1S0B0MEeacvQ6cODzg5Q,0.75
1320,"Basically assignments were unclear (I had to do lots of resubmissions), but everything else was fine.",RZ1S0B0MEeacvQ6cODzg5Q,0.736842105263
1321,Very interesting subject and data science skills are definitely currently in demand. The only thing that bugged me was that the grader didn't give much feedback on anything you did wrong. On the flip side the mentors did a GREAT job (kudos to you guys). The discussion forums were vital and they were really well moderated. ,RZ1S0B0MEeacvQ6cODzg5Q,0.634920634921
1322,"Nice course! there is only one suggestion I want to send you, the video is so short that we can not learn the pandas more in the course. So I hope you can provide more detailed videos thanks. ",RZ1S0B0MEeacvQ6cODzg5Q,0.642857142857
1323,"This is very helpful course, my skills horned after undergoing through this sessions. My expertise and style of using python for data analysis changed. Articles and group discussions about P-hacking made me to realize the pitfalls, I may enter once I get addicted to proving my hypothesis correct. I got an idea, what better I can understand; when data speaks. I am waiting for next module of this course. Please start it as possible.",RZ1S0B0MEeacvQ6cODzg5Q,0.616279069767
1324,Perfect courses! With a lot of opportunities to practice and to learn from do questions by yourself. Mentors and staffs are also kindly to answer problems. ,RZ1S0B0MEeacvQ6cODzg5Q,0.586206896552
1325,Really good introductory course to Pandas. Teaching stuff was a big help and forums are very active and informative. Very good work. Area of improvement: The estimated timings of completion are too optimistic :),RZ1S0B0MEeacvQ6cODzg5Q,0.631578947368
1326,The duration of the course (4 weeks) was ideal. It was manageable as a part time course. The tests helped me a lot to practice and learn the concepts deeply. The forums were very helpful in clarifying the questions. The video quality was great.Many thanks for this great course which is made available online for free for all the world.,RZ1S0B0MEeacvQ6cODzg5Q,0.536231884058
1327,Helpful,RZ1S0B0MEeacvQ6cODzg5Q,1.0
1328,This course will be a great start for people to know about data science with python and get familiar with few simple data.,RZ1S0B0MEeacvQ6cODzg5Q,0.875
1329,"I certainly learnt a lot through this course. The hands on oriented approach of this course works wonders for those who intend to dig deeper and improve their Python programming. The lectures are crisp and clear, but the main learning happens while doing the weekly assignments. Each assignment forces us to go search for content beyond what has been taught in the lectures and in this process we find new things. Also, the lecturer informed us about some good reference books for individual learning. I look forward to taking part two of this course. The mentors in the discussions forum are quite active and helpful. The forum was of big help to me for clearing the assignments. The only flaw I found was that the autograder does not clearly define our mistakes and that's where the mentors come in and explain in the discussion forum. This part could be better automated. Finally, I believe that a prior introduction to Python programming is an essential prerequisite to this course.",RZ1S0B0MEeacvQ6cODzg5Q,0.510869565217
1330,The assignments were challenging and cool. Lot of self-study needed to crack them. The lecture videos could have been a bit more interesting.,RZ1S0B0MEeacvQ6cODzg5Q,0.678571428571
1331,"I have struggled a lot during this course to complete the assignments. It is hard, it is well taught and you learn a lot!",RZ1S0B0MEeacvQ6cODzg5Q,0.666666666667
1332,"The lecturer is excellent, the forums are active and useful and the exercises are a good mixture of challenging and enjoyable. A very good course overall.",RZ1S0B0MEeacvQ6cODzg5Q,0.551724137931
1333,The course material is very short and precise. Previous knowledge of Python is helpful. This course serves its purpose as an introduction to Python libraries and how they are used in the field of Data Science. ,RZ1S0B0MEeacvQ6cODzg5Q,0.717948717949
1334,"Too much focus on databases and database operations, rather than data science.The assignments are too difficult for a 4 week course.",RZ1S0B0MEeacvQ6cODzg5Q,0.64
1335,This course was over all okay. My primary complaints are that I felt that the class moved too quickly and relied too heavily on students to teach themselves through the Pandas documentation. The Pandas documentation is really only so-so and it would have been nice to have more guidance through the course materials.,RZ1S0B0MEeacvQ6cODzg5Q,0.586206896552
1336,"The course content is great - Prof Christopher seriously made justice to the content. He is great instructor. He has presented course in right manner, with right speed. Looking for more courses from Him. ",RZ1S0B0MEeacvQ6cODzg5Q,0.564102564103
1337,"I learnt a lot, and enjoyed the process! It was more engaging than I expected of an online course. Excited to go forward with the specialization.",RZ1S0B0MEeacvQ6cODzg5Q,0.7
1338,"All the ingredients are there, but it would be nice to have more hand-holding given the ramp-up in difficulty in only a few weeks.",RZ1S0B0MEeacvQ6cODzg5Q,0.733333333333
1339,It was very hard but extremly learnful.,RZ1S0B0MEeacvQ6cODzg5Q,0.625
1340,One of the best Courses I have done online. Took me back to basics and gave the best possible introduction to python which was beyond my expectations,RZ1S0B0MEeacvQ6cODzg5Q,0.714285714286
1341,"Excellent course and lot to learn, one of the best data analysis toolkit available.",RZ1S0B0MEeacvQ6cODzg5Q,0.8125
1342,"The course lectures were subpar and didn't cover the material in the assignments. Googling for answers and checking stackoverflow for code is a great way to get tips, but it doesn't teach you the core material. I would have rather had links to supplemental readings that the materials were based on. I would not recommend this course as an introduction course unless you've had significant experience with Python data structures and know how to work with lists, dataframes, and iterate over those. ",RZ1S0B0MEeacvQ6cODzg5Q,0.515789473684
1343,Thanks a lot for your work. It's a great course for data sciense in python!,RZ1S0B0MEeacvQ6cODzg5Q,0.684210526316
1344,"A lot of the harder questions were unclear or not covered by the course. Many were passed onto look this up yourself, which is fine, but sometimes a different approach resulted in a slightly different answer marked as wrong. The group_by stuff was especially tricky, as it was unlike its SQL counterpart and could have used a better example, eg with a function to split into quarters or group columns. Other than that, very interesting overall and very neat datasets. I would encourage having students check out kaggle.com for extra credit.",RZ1S0B0MEeacvQ6cODzg5Q,0.650485436893
1345,"Really good course with challenging assignments. However, the grader has some issues, for every assignment I had to spend more time trying to figure out how to make the grader accept my answers than actually solving the problems.",RZ1S0B0MEeacvQ6cODzg5Q,0.619047619048
1346,The assignments were very well made and the discussion forums were also very well moderated. I will highly recommend this to any of my peers who are interested.,RZ1S0B0MEeacvQ6cODzg5Q,0.666666666667
1347,The material seemed a bit hurried at times..but overall a great learning experience and the assignments were truly helpful,RZ1S0B0MEeacvQ6cODzg5Q,0.761904761905
1348,Great Course!,RZ1S0B0MEeacvQ6cODzg5Q,0.666666666667
1349,"Two stars because I have found poor explanations of assignments. I finished the course without being very clear what I was asked, and I lacked more feedback when one of the tasks is wrong. The teacher and the videos are very good.",RZ1S0B0MEeacvQ6cODzg5Q,0.565217391304
1350,Excellent course in one word,RZ1S0B0MEeacvQ6cODzg5Q,1.0
1351,"Good course, if a bit fast paced, expect a great deal of searching through documentation and stackoverflow, but it is to be expected from an intermediate level course.",RZ1S0B0MEeacvQ6cODzg5Q,0.75
1352,I never thought this Data Science course was going to be that challenging and exciting at the same time. I have really enjoyed this first course and I am about to enroll for the coming courses. Well explained concepts and very comprehensive videos. Congrats!,RZ1S0B0MEeacvQ6cODzg5Q,0.604166666667
1353,Looks like it's prealpha version of what it might be.,RZ1S0B0MEeacvQ6cODzg5Q,0.615384615385
1354,"Advanced Python! It was hard, but I enjoyed it! ",RZ1S0B0MEeacvQ6cODzg5Q,0.583333333333
1355,Excellent to get started with data science with Python. Very good instructor and lots of hands on exercises. Kudos!,RZ1S0B0MEeacvQ6cODzg5Q,0.681818181818
1356,"Last assignment was *painful*: Poorly described instructions, outcomes/outpu; the grader was opaque and largely mute.",RZ1S0B0MEeacvQ6cODzg5Q,0.5
1357,"good when it's been around for a while, else frustrated with a lot of unclear instruction and no support.",RZ1S0B0MEeacvQ6cODzg5Q,0.782608695652
1358,It needs some previous experience with Python and if possible with Pandas,RZ1S0B0MEeacvQ6cODzg5Q,0.833333333333
1359,"It's great course, but the assignments are so hard to data science beginner.",RZ1S0B0MEeacvQ6cODzg5Q,0.764705882353
1360,the homework is interesting,RZ1S0B0MEeacvQ6cODzg5Q,1.0
1361,Briskly paced course for those new to Python and/or Pandas. Good weekly exercises that ended with a real life data analysis exercise in week 4.,RZ1S0B0MEeacvQ6cODzg5Q,0.793103448276
1362,Thanks for introducing Pandas and Anaconda!,RZ1S0B0MEeacvQ6cODzg5Q,0.571428571429
1363,The course is well structured and clarity of teaching is impressive. The assignments have a good mix of easy and progressively tougher questions that build on the syllabus and challenge you to manipulate data in your own way. I can warmly recommend this course to anyone who wants to begin manipulating and analysing data using python. ,RZ1S0B0MEeacvQ6cODzg5Q,0.64406779661
1364,"I learned good materials for Python from this class. The assignments are good. Only one comment: the writing of the assignments can be very vague and at times it is hard to understand. Overall, I like the class. ",RZ1S0B0MEeacvQ6cODzg5Q,0.659090909091
1365,"Hard course, but good ROI.",RZ1S0B0MEeacvQ6cODzg5Q,0.714285714286
1366,"While this was one of the better courses I've done on Coursera, the start date of the course was changed without any indication of when it would begin. We've also been waiting months for the next course in the specialisation to begin, again without any communication. This was a good course, but I would recommend people wait until all the rest of the courses are available before starting this course and beginning the specialisation.",RZ1S0B0MEeacvQ6cODzg5Q,0.535714285714
1367,"It was challenging yet fun to learn this course. Last but not least, the http://stackoverflow.com is really helpful. I highly recommend it to anyone who want to learn Python.",RZ1S0B0MEeacvQ6cODzg5Q,0.621621621622
1368,This course has helped me equip basics knowledge of Python Pandas.,RZ1S0B0MEeacvQ6cODzg5Q,0.583333333333
1369,Good at setting up the framework for the assignments. Google/stackoverflow is your friend. The course materials presents the information but you will have to go and actively learn a good amount of material. I enjoyed this approach but some may be looking for a more contained course. ,RZ1S0B0MEeacvQ6cODzg5Q,0.622641509434
1370,"a little more help from the video lectures is expected. The assignments required a lot of self study which is great but at the beginning, every assignment looks daunting and discourages a little. Although the forums helped a lot in getting through this course, but the majority of the roadmap to take, and all other lessons should be included in the videos.",RZ1S0B0MEeacvQ6cODzg5Q,0.514705882353
1371,First two weeks are great. The third week becomes a bit disporportionately difficult. The autograder is very inflexible. ,RZ1S0B0MEeacvQ6cODzg5Q,0.666666666667
1372,very practical and efficient - high useful skills gained per time spent ratio!,RZ1S0B0MEeacvQ6cODzg5Q,0.714285714286
1373,"Useful and concise lectures, interesting exercises!",RZ1S0B0MEeacvQ6cODzg5Q,0.5
1374,"Although I learned a lot in this course, I found the lectures and assignments to be much too different from each other. I would like to see assignments where you must practice what is learned in the lecture. For myself, I feel I learned 1 set of concepts from the lectures and another set from the assignments by spending time on stack overflow and the pandas documentation. Both are good but the lectures and assignments did not flow together as I would have liked.",RZ1S0B0MEeacvQ6cODzg5Q,0.577777777778
1375,The instructor was great . The assignments were good and helped me learn a lot.,RZ1S0B0MEeacvQ6cODzg5Q,0.6875
1376,"It is a great, brief introduction to Pandas. I think it is ideal for someone who already knows Python but doesn't have much experience with Pandas. Lectures are well structured with quizzes interspersed. Homework assignments are also well structured and use real data.",RZ1S0B0MEeacvQ6cODzg5Q,0.6
