,comment,course_id,ratio
10041,"The course is great otherwise, however the certificate of this course just completed 'Data Management and Visualization' with no mention about the skills learnt or the grade attained. Primary reason I enrolled to the course was to list 'SAS' (basic) as a skill in my resume, however the certificate does not mention anything about SAS. If at least the certificate said completed 'Data Management and Visualization with SAS', it would be a good value for money. I strongly recommend Coursera should look into this. Thanks!",6JyoHjVOEeWBMQ5pdIoFkQ,0.55
10042,This is a good course. I have done stats in the past so i was using this as a refresher but also to advance my python skills a bit more. I think you should take an introduction course to python first. you will get more out of the coding examples. I suggest the Intro to Python by the University of Toronto at Coursera. I found that to be an excellent course.I find that in these lectures they do a great job in explaining the stats theory. They do not dwell to much into the science behind it but more the applicability. This is all good. You can simply do a little additional research and get the pure science behind of it all,6JyoHjVOEeWBMQ5pdIoFkQ,0.5
10043,perfect first touch with data management,6JyoHjVOEeWBMQ5pdIoFkQ,1.0
10044,Course content good but a little too basic in my eyes. I think the addition of more functions in SAS/Python would be useful. Having to do peer reviews is also not ideal.,6JyoHjVOEeWBMQ5pdIoFkQ,0.72972972973
10045,"A decent start for anyone interested in learning the basics. However, please make sure you add extra efforts from your end in understanding stats concepts if you are totally new to the subject as well as browsing things related to usage of SAS or python. The course touches only the basics so it is up the learner to explore and learn more about interested statistical tool.",6JyoHjVOEeWBMQ5pdIoFkQ,0.685714285714
10046,"A very beginner level course aimed at starters who dont have much experience with Data. Emphasis was on teaching Data Management with area of our interest. In Order to support this, assignments didnt had clear objective. I would have learnt a lot more through a course had they been more defined assignments.Not a course if you are looking to be ready for data related interviews. However, this course will be okay if you are working on some other field and want data management as an extra skillset.",6JyoHjVOEeWBMQ5pdIoFkQ,0.625
10047,My name is Jose Antonio from Brazil. I am looking for a new Data Scientist career (https://www.linkedin.com/in/joseantonio11)I did this course to get new knowledge about Data Science and better understand the technology and your practical applications. The course was excellent and the classes well taught by teachers.Congratulations to Coursera team and Instructors.,6JyoHjVOEeWBMQ5pdIoFkQ,0.528571428571
10048,"Great course, clear introduction to concepts and code",6JyoHjVOEeWBMQ5pdIoFkQ,0.777777777778
10049,Good classes for learning SAS,6JyoHjVOEeWBMQ5pdIoFkQ,0.8
10050,"It is a good beginners course but I think there are better lessons in SAS and Python if learning these is your goal, and the content in data cleaning and visual analysis is very basic. ",6JyoHjVOEeWBMQ5pdIoFkQ,0.72972972973
10051,Very nice course! Good starting point of learning SAS!,6JyoHjVOEeWBMQ5pdIoFkQ,0.727272727273
10052,Very easy and very helpful course,6JyoHjVOEeWBMQ5pdIoFkQ,0.833333333333
10053,Good Course simplistic way in explaining core concepts,6JyoHjVOEeWBMQ5pdIoFkQ,0.875
10054,"The professor and instructors don't understand how to properly write SAS programs and ignored constructive feedback. It's very sad to see students follow suit by producing hard to read codes, ignoring programming conventions. As an analytic leader in healthcare industry (I am supervising some of my junior level team members to get some basic training), I want to say something to the students graduated from this course: if you program the same way as being taught, you will lose a competitive advantage during job interview.",6JyoHjVOEeWBMQ5pdIoFkQ,0.628865979381
10055,wonderful study experience???,6JyoHjVOEeWBMQ5pdIoFkQ,0.75
10056,"A fantastic course for beginners, and an extremely useful tool to learn! Recommended for anyone who wants to get started coding or increase their work skills",6JyoHjVOEeWBMQ5pdIoFkQ,0.642857142857
10057,"It is a very nice course, although I was expecting something a little deeper / denser on both statistics and SAS programming. It is getting better on Module 2! =)",6JyoHjVOEeWBMQ5pdIoFkQ,0.545454545455
10058, Excellent course easy to understand and very practice evaluation ,6JyoHjVOEeWBMQ5pdIoFkQ,1.0
10059,Nice introductory course to learning both SAS and Python in data analysis! I look forward to taking the next course!,6JyoHjVOEeWBMQ5pdIoFkQ,0.772727272727
10060,"I think the course is wonderful for beginners. For somebody trying to learn this on her own, I found this course extremely helpful and easy to grasp. ",6JyoHjVOEeWBMQ5pdIoFkQ,0.7
10061,Great way to get started in this field!,6JyoHjVOEeWBMQ5pdIoFkQ,0.777777777778
10062,It is too small and shallow. Whole specialization is actually one full course split into 4 tiny parts.,6JyoHjVOEeWBMQ5pdIoFkQ,0.75
10063,"Great! Easy to follow, very well video lecture, and very useful!",6JyoHjVOEeWBMQ5pdIoFkQ,0.666666666667
10064,Great,6JyoHjVOEeWBMQ5pdIoFkQ,1.0
10065,Choosing an actual research question allows you to find a topic of interest. This makes the content more meaningful and accelerates understanding of the concepts.,6JyoHjVOEeWBMQ5pdIoFkQ,0.703703703704
10066,"There is a lot of self-teaching with these courses because there are no professors present to reach out to with questions. In addition, the course staff do not always respond promptly nor are they fully knowledgeable about all aspects of error messages that may arise out of coding. At times the code that were provided in the lecture videos were out of date and a lot of time was spent on googling to find the updated code. This is definitely not a beginner coder course and I do not recommend it to anyone who has not coded before. ",6JyoHjVOEeWBMQ5pdIoFkQ,0.561904761905
10067,"It was good overall, some of the course materials were a bit sparse. You had to do your own research into getting packages working in spyder etc. I'd probably recommend that learners learn some python separately and read the docs for pandas.",6JyoHjVOEeWBMQ5pdIoFkQ,0.708333333333
10068,The course videos are fantastic,6JyoHjVOEeWBMQ5pdIoFkQ,0.8
10069,Well done. Thank you.,6JyoHjVOEeWBMQ5pdIoFkQ,0.666666666667
10070,Awesome course. Thanks Prof.,6JyoHjVOEeWBMQ5pdIoFkQ,0.666666666667
10071,"Thank you so much for the course! I liked the research project, it game me a lot of interesting knowledge. I thought in the beginning it is pretty easy course but the last assignment took me a while. ",6JyoHjVOEeWBMQ5pdIoFkQ,0.690476190476
10072,I saw little interactions between students and in the discussion list. But I liked to learn a new language!,6JyoHjVOEeWBMQ5pdIoFkQ,0.714285714286
10073,V,6JyoHjVOEeWBMQ5pdIoFkQ,1.0
10074,"The course has its positives, but overall does not perform well instructing on the use of the two statistical software offered (SAS &amp; Python). At the beginning they offer multiple data sets to use and formulate a research question, but all the examples utilize only one data set and do not cover the differences you might face with the other data sets - leading to a lot of missed opportunities. Additionally, the tutorials for using the statistical software do not lend themselves towards a thorough understanding and more to a route learning.",6JyoHjVOEeWBMQ5pdIoFkQ,0.50495049505
10075,"Very good introductory course on managing, subsetting, and manipulating data with SAS or Python.",6JyoHjVOEeWBMQ5pdIoFkQ,0.588235294118
10076,"The highest video production values of any class I've seen on Coursera so far. Unfortunately, that's the best part of the class; the support is simply nonexistent (a post by someone associated with the staff from a previous run of the course suggests getting help troubleshooting Python from Coursera staff), the instructions for the class software are out of date, the source material for the assignments is sometimes unsuitable to the task you're asked to perform (e.g. statistical analysis on a data set aggregated from disparate sources), and the pretty videos are at times completely unrelated to the actual assignments (the very first week with the literature review). Dropping this specialization like a hot coal; it looked quite promising, but the aggravation over the poor organization and lack of support considerably outweighs anything I could get out of it.",6JyoHjVOEeWBMQ5pdIoFkQ,0.534161490683
10077,Very nice lecture videos and explanations! Totally worth it,6JyoHjVOEeWBMQ5pdIoFkQ,0.7
10078,"The course is a very good introduction to Python for data exploration and management. That being said, it focuses too much on categorical data analysis, and I felt the transition to quantitative/continuous data was not very well done.Moreover, some more explanations about several Python functions or coding choices could be better explained.But it's encouraging to see this type of statistical course for Python and not R!! Again!",6JyoHjVOEeWBMQ5pdIoFkQ,0.62962962963
10079,Great course! Perfect for starting in analysis of data,6JyoHjVOEeWBMQ5pdIoFkQ,0.9
10080,The slides are excellent and instructions are clear and to the point. But that point is very limited. The main negative about this class is that there is absolutely no student/TA/teacher feedback and you're pretty much on your own learning. ,6JyoHjVOEeWBMQ5pdIoFkQ,0.65306122449
10081,"I have never used SAS. I have done minimal statistics and my major in university was Sociology, which I did 20 years ago. So needless to say, I don't remember much. This course was easy to understand and was structured in a way to build upon knowledge from one week to the next. ",6JyoHjVOEeWBMQ5pdIoFkQ,0.655737704918
10082,Great step to learn data analysis in SAS! ,6JyoHjVOEeWBMQ5pdIoFkQ,0.777777777778
10083,"They put a lot of effort into this course, but especially for the videos it was a bit too much. So many different visual backgrounds, sounds, music, text floating it... It's as if they just wanted to use everything, while never thinking about when it would start being too distracting.",6JyoHjVOEeWBMQ5pdIoFkQ,0.666666666667
10084,Beautifully designed course. Really helps me understand basic data analysis and improve reporting skills. ,6JyoHjVOEeWBMQ5pdIoFkQ,0.6875
10085,Good Learning experience and loved the way of teaching.,6JyoHjVOEeWBMQ5pdIoFkQ,0.8
10086,excellent course especially for those interested into playing with data,6JyoHjVOEeWBMQ5pdIoFkQ,0.9
