,comment,course_id,ratio
1490,"Good for Beginners. Assignments are good but question framing was poor. Of course, required doubts are clarified through Discussions. Overall Great Experience doing this course. Thank you!",RZ1S0B0MEeacvQ6cODzg5Q,0.545454545455
1491,Very nice course. The only problem that I found was the lack of exercises between assignments.,RZ1S0B0MEeacvQ6cODzg5Q,0.722222222222
1492,Challenging course but worth the effort! ,RZ1S0B0MEeacvQ6cODzg5Q,0.714285714286
1493,Very good intro into how to use Pandas for working with data sets and get insights from your data by using various aggregating functions and statistical tests.,RZ1S0B0MEeacvQ6cODzg5Q,0.607142857143
1494,Took me ages to complete the assignments given my limited programming skills! But totally enjoyed solving the problems. ,RZ1S0B0MEeacvQ6cODzg5Q,0.5
1495,"This course systematically introduced the use of Python and Pandas library to read data, clean data, transform data, and do statistical analysis.",RZ1S0B0MEeacvQ6cODzg5Q,0.653846153846
1496,"Superb course and the staff from University of Michigan were quite committed with the learners, they've given me very valuables tools and skills, thanks a lot.",RZ1S0B0MEeacvQ6cODzg5Q,0.612903225806
1497,Top free course about Data Science. But I think lectures must be more detailed and related to assignments. And assignments could be less ambiguous and more clear.,RZ1S0B0MEeacvQ6cODzg5Q,0.666666666667
1498,"This is a really great course. Christopher Brooks teaches in a very clear and objective way, in addition to the weekly assignments that are challenging and puts into practice all the content you've learned trough the videos and the material. I really recommend this course!",RZ1S0B0MEeacvQ6cODzg5Q,0.549019607843
1499,"Although I had some background with Python and Pandas, this course brought new insights in both. With practical examples, it reinforces the conceptual understanding about working with data. I highly recommend this course even if you are already familiar with Pandas",RZ1S0B0MEeacvQ6cODzg5Q,0.666666666667
1500,"This is a fantastic introductory data science course on Python! I was wondered by the course structure, in-browser code editing and submitting. The first course which granted me an understanding of data cleansing, pandas and python for data science.",RZ1S0B0MEeacvQ6cODzg5Q,0.586956521739
1501,"The lectures and explanations need more clarity and better instruction quality. The assignment questions were often nebulous. This resulted in lots of time wasted with the grader. The discussion forums were the best part of this class. I'd encourage the course instructors to take a look at the University of Washington's Machine Learning class. Stylistically, pedagogically and content-wise - that's a much, much better Data Science class. ",RZ1S0B0MEeacvQ6cODzg5Q,0.542168674699
1502,Best Python Pandas 101 course ever. Very recommend,RZ1S0B0MEeacvQ6cODzg5Q,0.666666666667
1503,"I really like this course, it is a good kick off to learn and practice Pandas. The assignments are more difficult than the avg assignment in coursera courses which I think made this course more productive.",RZ1S0B0MEeacvQ6cODzg5Q,0.666666666667
1504,It is a great course. especially on the excellent assignments.,RZ1S0B0MEeacvQ6cODzg5Q,0.75
1505,"This course was much harder than anticipated given it was also my first introduction to Python. Knowing Python coming into this course will make it a lot more manageable. Overall it's an excellent course which touches upon a LOT of items. Given more time on each item, this course could span 10 weeks easily. I now have an understanding of Python basics along with Pandas and a dash of numpy.",RZ1S0B0MEeacvQ6cODzg5Q,0.576923076923
1506,"I love this kind of courses wehn the lectures are clear, short and meaningfull with real topics and hands on the topic, really good course",RZ1S0B0MEeacvQ6cODzg5Q,0.62962962963
1507,This course helps me a lot! Thanks for all staffs. Hope the grader system coud give more specific feedback.,RZ1S0B0MEeacvQ6cODzg5Q,0.727272727273
1508,"Assignments are challenging, but some questions are very vague and require lots of trial and error guesswork to get the autograder to accept them.",RZ1S0B0MEeacvQ6cODzg5Q,0.653846153846
1509,"I was quite disappointed by the almost total inaccessibility of the staff in the discussion forums, the unconquerability of the autograder for most of the assignments (losing points for no discernible reason, with all resources exhausted), the lack of a stats module for the specialization, and the lack of education, really. There is value in asking students to learn on their own, but this course goes much too far with that, giving problem sets that are virtually unsolvable without prior experience in data wrangling in R or some other data language. This leaves serious, hardworking students with little choice but to troll the forums for solutions. Hardly the best way to learn the intricacies of this subject.",RZ1S0B0MEeacvQ6cODzg5Q,0.523076923077
1510,"great hands on course, with challenging exercises and fast paced lectures.the homework assignments need some rephrasing, as it is not always clear whats being asked.looking forward to the second course in this specialization",RZ1S0B0MEeacvQ6cODzg5Q,0.666666666667
1511,Overall I thought the level of the course was good. The programming assignments were complex and long enough that you had a good opportunity to re-inforce topics covered in the course. I already had a good bit of pandas experience so the course was helpful to re-inforce things I was already familiar with but hadn't been forced to try out. I think if you don't already have pandas experience the assignments might be tough.,RZ1S0B0MEeacvQ6cODzg5Q,0.5
1512,High quality content and challenging assignments. Really good!,RZ1S0B0MEeacvQ6cODzg5Q,0.6
1513,"This course is accurately advertised as requiring intermediate programming experience. It focusses on some of the basic python tools that are used in data science like pandas, specifically dataframes. For a python newbie like me, some of the assignments were quite challenging as they required significant additional reading and search. I would have appreciated if all of the concepts required to solve the assignments were introduced in the same week, so my additional reading and search would have been more targeted. Very little stats if any is required or taught. ",RZ1S0B0MEeacvQ6cODzg5Q,0.530612244898
1514,"I thought the videos for this course were appropriately concise and well-done. The projects were about the right difficulty and length (although the one for week three was more time consuming than expected). They were interesting enough to keep engaged. I think the span of topics was also useful and appropriate. I would have liked if the autograder gave more detailed output on what was wrong with a submission. I also think it would be extremely beneficial to see the right ways of solving this problems after a submission is completed. I'm sure I didn't use the optimal pandas approach in some instances, as it stands I seem to have no way of knowing and improving my knowledge beyond getting a passing grade.",RZ1S0B0MEeacvQ6cODzg5Q,0.557971014493
1515,"Not so easy ,not too hard!",RZ1S0B0MEeacvQ6cODzg5Q,0.625
1516,Good content - some prior knowledge of pandas is important.,RZ1S0B0MEeacvQ6cODzg5Q,0.727272727273
1517,"Good course, going a bit fast on certain aspects but good use of Jupyter and interesting coursework, challenging enough.",RZ1S0B0MEeacvQ6cODzg5Q,0.636363636364
1518,Good lectures and a good introduction to the subject matter. Definitely requires additional research and practice is weak on Python and the Pandas library. The comments in the auto grading could be more helpful.,RZ1S0B0MEeacvQ6cODzg5Q,0.648648648649
1519,"Good introductory course, but I must admit that the assignments are not explained well enough.",RZ1S0B0MEeacvQ6cODzg5Q,0.764705882353
1520,"Very nice introduction, I wish homework were more clear and the autograder was much more smarter. ",RZ1S0B0MEeacvQ6cODzg5Q,0.722222222222
1521,the best ever,RZ1S0B0MEeacvQ6cODzg5Q,1.0
1522,it has a very good method of teaching and it is very informative :)),RZ1S0B0MEeacvQ6cODzg5Q,0.714285714286
1523,"This is a popular course series that many have expressed interest in taking. Rigorous and challenging course that offers excellent, high quality teaching of python pandas. The University of Michigan does not disappoint and neither does the delightful instructor Christopher Brooks. I highly recommend this course to anyone serious about python and data manipulation. Time and money worth spent. Interesting assignments and datasets are found each week. You will learn a great deal. Concise videos with sharp insights from an expert on pandas are seen throughout. Once you finish the first course of the series, it leaves you excited for the second course in the series. Rock on pandorable pandistas! ",RZ1S0B0MEeacvQ6cODzg5Q,0.581967213115
1524,Wonderful Instructor. Course assignment is strong enough to learn this things. Thanks for this great course.,RZ1S0B0MEeacvQ6cODzg5Q,0.684210526316
1525,Excellent one,RZ1S0B0MEeacvQ6cODzg5Q,1.0
1526,"Completed the course and found it pretty good for the first run. Mostly focused on the Pandas library - you'll be ok if you know a bit of Python, or have experience in another language.Looking forward to subsequent courses.",RZ1S0B0MEeacvQ6cODzg5Q,0.673913043478
1527,"assignment is really hard, takes me 30 hours at least",RZ1S0B0MEeacvQ6cODzg5Q,0.636363636364
1528,"Super challenging, but good fun!",RZ1S0B0MEeacvQ6cODzg5Q,0.571428571429
1529,This is a very useful course. I recommended this course at people that already know how to programming. Week's homework are more difficult than in the description and needs more time( for my personal experience ),RZ1S0B0MEeacvQ6cODzg5Q,0.756097560976
1530,Good COurse ,RZ1S0B0MEeacvQ6cODzg5Q,1.0
1531,One of the best place to start in Data Science,RZ1S0B0MEeacvQ6cODzg5Q,1.0
1532,"The instructor is warm and seems pretty interested.Content is way too minimal though and it's not enough to prepare the student for the assessments.A lot of searching is required in order to arrive at the solution which more often than not is not the most optimum one. Forums are only supported by fellow students and staff's involvement is next to zero in there. Even threads that deal with clarifying questions were not answered by the staff.I understand that this way enforces community building and helping fellow students, but staff's participation would be highly appreciated.",RZ1S0B0MEeacvQ6cODzg5Q,0.554545454545
1533,"It's a good course over all. There is only one thing that I would like to suggest, which is that the autrograder does not seem to work well. It really wasted me lots of time to get the RIGHT ANSWER understood by the autograder.",RZ1S0B0MEeacvQ6cODzg5Q,0.72
1534,great intro course,RZ1S0B0MEeacvQ6cODzg5Q,0.666666666667
1535,Very good... but question should have been properly explained (in a detail manner).. overall it was a great learning experience,RZ1S0B0MEeacvQ6cODzg5Q,0.782608695652
1536,great course,RZ1S0B0MEeacvQ6cODzg5Q,1.0
1537,"Lectures clear and well-organized. Homework needlessly complicated and with large gap from lecture material. Grader did not give enough info when rejecting submitted work. Weighting last problem at 50% of final week was unpleasant. Hosted platform allowed importing re and io.StringIO, but grader rejected them. Hosted platform had consistent kernel failure on my last solution, but it worked on another system and grader accepted it.",RZ1S0B0MEeacvQ6cODzg5Q,0.589743589744
1538,"Good material, let down by instructors. ",RZ1S0B0MEeacvQ6cODzg5Q,0.625
1539,quite interesting and challenging,RZ1S0B0MEeacvQ6cODzg5Q,0.75
1540,Good one! Enjoyed,RZ1S0B0MEeacvQ6cODzg5Q,0.5
1541,"Contents are very good and assignments are challenging. Perhaps I struggled most trying to understand what the questions actually ask, they should be rephrased or be more clear. But it was a nice course and I would to it again. I am waiting for the next courses to begin.",RZ1S0B0MEeacvQ6cODzg5Q,0.62962962963
1542,Thanks!,RZ1S0B0MEeacvQ6cODzg5Q,0.5
1543,The course was really great. Thank you! Sometimes precisely what the questions were asking weren't clear (This may have been resolved by a notebook upgrade but I did not realise this until it was too late) and I did have some issues with the autograder. Otherwise would be five stars.,RZ1S0B0MEeacvQ6cODzg5Q,0.637931034483
1544,"Really handy and useful materials. However, if we can share our codes online after receiving the certificate will be really helpful. Cause although I finished the course, I still find some of my code is repetitive and not pandorable, and I would like to learn from other talents. Thanks Coursera and University of Michigan. ",RZ1S0B0MEeacvQ6cODzg5Q,0.639344262295
1545,"Autograder is hard to understand and has no feedback. Could improve the feedback mechanism, maybe with peer review. Thanks for the course!",RZ1S0B0MEeacvQ6cODzg5Q,0.692307692308
1546,I learned A LOT during this course. I was even able to apply some of this knowledge at work after week 2 (and I do not have a technical job - I do this on my own time).It did feel a little complicated at some times. Some more detailed explanations in the assignments could help. We don't always know what the autograder expects...,RZ1S0B0MEeacvQ6cODzg5Q,0.652777777778
1547,"A course which has great assignments. However, the video itself is a bit boring. Most of the time, my motivation to learn this course is just doing its assignments. At the same time, the assignments are somewhat difficult for those who are not familiar with Python, but for me it's just OK. What I want to make complaints about the assignments is that sometimes the Autograder is so rigid that I have to try one question over and over again until the Autograder feels happy, and for me, sometimes the gap between correct answer and incorrect answer isn't so large...And finally, thank you, teacher Christopher Brooks! You are ateacher full of passion, and I actually learnt a lot from you and your course.",RZ1S0B0MEeacvQ6cODzg5Q,0.513888888889
1548,"Lectures were interesting and well put together, however the assignments and the knowledge required for the assignments were not covered in the lecture material. While I can appreciate that every course will require some elements of self-learning and exploration, this felt a step too far. My sense is that if you have some experience in the actual topics covered by the course, and are looking to verify your knowledge with a certificate, you will be fine. However if you are hoping to actually learn about the topics, you are going to have to work very hard. I'm hoping that the coverage of course material to assignment requirements is a lot better in the subsequent courses in this specialization.",RZ1S0B0MEeacvQ6cODzg5Q,0.507575757576
1549,This course covers basics of pandas dataframes. So useful for amateur/advanced programmers who want to start learning data science. The assignments are very good and help students learn how to pre-process and use data retrieved from web.,RZ1S0B0MEeacvQ6cODzg5Q,0.613636363636
1550,"A hands on course on the basic tools needed to process data from experiments, web data, etc. The final assignment demands everything learned througout the course and it's a perfect example for what one would face on a daily basis.",RZ1S0B0MEeacvQ6cODzg5Q,0.565217391304
1551,starting to like this,RZ1S0B0MEeacvQ6cODzg5Q,1.0
1552,"Very hard course comparatively speaking, especially when one needs to manage so many other things. But I think it was worth the figurative blood and tears. Thank you!",RZ1S0B0MEeacvQ6cODzg5Q,0.8125
1553,Great course,RZ1S0B0MEeacvQ6cODzg5Q,1.0
1554,"Excellent class, learned quickly and simply !",RZ1S0B0MEeacvQ6cODzg5Q,0.75
1555,Really great course about data science in python and pandas in particular. Absolutely recommended!,RZ1S0B0MEeacvQ6cODzg5Q,0.6875
1556,Learn a lot with Pandas.,RZ1S0B0MEeacvQ6cODzg5Q,0.666666666667
1557,"I have two general comments:The first comment is . . . there was too wide a gap between the lecture content and the assignments. The second comment I have is . . . I spent too much time trying to figure out what the autograder wanted and not enough time learning Data Science with Python. I can only imagine the work that it takes to develop and launch a course like this. In all, I'm very excited to be part of this program. My comments are critical but hopefully helpful and all your work is appreciated.",RZ1S0B0MEeacvQ6cODzg5Q,0.575471698113
1558,"This course wasn't quite the cakewalk I was expecting it to be, which is perfectly fine! I definitely would recommend this course for anyone looking to pursue data science/machine learning professionally. I learned a lot of skills that employers look for, and have applied the things I've learned here in other course work as well. 5/5 would recommend.",RZ1S0B0MEeacvQ6cODzg5Q,0.583333333333
1559,"Great course, assignments take more time than listed, and I found the discussion forum very helpful to learn more about the assignments and interact with other classmates. Overall I learned so much of commands from this course. ",RZ1S0B0MEeacvQ6cODzg5Q,0.682926829268
1560,The assignments do not have clear definition and guildlines. It is very hard to see what's getting wrong in the submission.,RZ1S0B0MEeacvQ6cODzg5Q,0.76
1561,Very good.,RZ1S0B0MEeacvQ6cODzg5Q,0.666666666667
1562,Great course! I liked how the focus was mainly on the practical aspects of data science. No 'dry' course material. I know much more about the practical side of data analysis than before! Thank you!,RZ1S0B0MEeacvQ6cODzg5Q,0.619047619048
1563,"The course is interesting, but the grading system needs to improve substantially. The grader bugs considerably, and the questions are often not well defined, which requires a lot of unnecessary trial and error to understand what exactly the question was about. Finally, complete the assignments took way long that what it is suggested.",RZ1S0B0MEeacvQ6cODzg5Q,0.65
1564,The assignments were good but it was a lot of time spent with the grader. ,RZ1S0B0MEeacvQ6cODzg5Q,0.8125
1565,Nice course to learn data science.,RZ1S0B0MEeacvQ6cODzg5Q,0.857142857143
1566,it's a really good course .it's not like a traditional course in university in China.You should put all your efford to finish it.And it full of challenge,RZ1S0B0MEeacvQ6cODzg5Q,0.638888888889
1567,"The course was great - the lectures were clear and simple; I learned a great deal! However, instructions for the assessments could have been clearer, and there were a few issues with the autograder (though I'm sure those will be weeded out).",RZ1S0B0MEeacvQ6cODzg5Q,0.58
1568,"Even short, but give a hint and big picture how data science works",RZ1S0B0MEeacvQ6cODzg5Q,0.928571428571
1569,"This course was excellent...I first found the course odd since the instructor went through the material quite quickly in the lectures. It took me a while to figure out that the material was available as a course download. Once I found that it was easy to follow along with the instructor...need two monitors ideally for this to work. If you cannot step through the Jupyter notebook as the instructor goes through the material, you will be lost...and you will not get the most out of the class.",RZ1S0B0MEeacvQ6cODzg5Q,0.540816326531
1570,"The course is good and provide great challenges to do a lot of things with Python and Pandas. However, I find that its resource material sometimes lacking complex examples. This may be intentional in order for the students to learn from external resources as well. However, this can also causes difficulties for people who are not already familiar with Pandas before they start following the course.",RZ1S0B0MEeacvQ6cODzg5Q,0.652777777778
1571,This course is a challenging (and solid) introduction to using python.,RZ1S0B0MEeacvQ6cODzg5Q,0.642857142857
1572,"This was way above my level knowledge. One will definitely a strong level of knowledge in stats and data analysis to begin with. The Python part is but only a tool in this module / course. For that reason I found the tutorials way too fast paced. I had to go back on everything and test, so a 5 mins tutorial video would sometimes take me 30 mins or longer to complete.The 3 hour / 4 hour assessments took me days! Yet - a great way to jump into something new! The course itself is great. The presentation and content is just as great.",RZ1S0B0MEeacvQ6cODzg5Q,0.582608695652
1573,I like the course very much. It was fun to learn and to do the exercises. There were some rough edges in the assignments but I'm sure these will be straightened out in time.,RZ1S0B0MEeacvQ6cODzg5Q,0.666666666667
1574,"The content and assignments are certainly useful and relevant. However, the lectures are too short and do not help much with doing the assignment. As a beginner, I relied heavily on google and the discussion forum to get through the assignment. And I am not sure if i can actually tackle similar problems again without referring back to the pre-mentioned resources.",RZ1S0B0MEeacvQ6cODzg5Q,0.550724637681
1575,Excellent! A little harder for new students in python but very interesting!,RZ1S0B0MEeacvQ6cODzg5Q,0.785714285714
1576,More concise coding tutorials and less search on your own on the internet needed. It is great to get to know the online community and the course needs more coding example directly relat to exams.,RZ1S0B0MEeacvQ6cODzg5Q,0.540540540541
1577,"Wow, this course was intense but worth it!",RZ1S0B0MEeacvQ6cODzg5Q,0.8
1578,A great introductory class to data science with challenging assignments to build a solid understanding of pandas and numpy . ,RZ1S0B0MEeacvQ6cODzg5Q,0.65
1579,"It is useful, but there are some notable flaws. My biggest problems were with the clarity of the assignment questions (some were unacceptably vague) and the feedback that the autograder gives. Fortunately, fellow classmates on the forums are extremely helpful in figuring this all out.",RZ1S0B0MEeacvQ6cODzg5Q,0.576923076923
1580,"Excellent class. Needs a little work to make sure assignments a little more clear, but with a bit of work from the student, it's a great learning experience. ",RZ1S0B0MEeacvQ6cODzg5Q,0.676470588235
1581,"The jupyter notebook made this a horrid experience. Plus Coursera really doesn't want you to bother them with your silly questions, relying on peer-forums. If you scroll through the week's discussion forums, many student posts go ignored.You can't drop the course past the second (I guess) week so the system will keep on keeping on long after you've given up on trying to figure out the janky notebook thing.Will not return to Coursera for any reason. Breathtakingly bad experience.",RZ1S0B0MEeacvQ6cODzg5Q,0.544554455446
1582,"Very knowledgeable professors, but very little explanation or actual 'teaching'. Graded assignments require a lot of self-education.",RZ1S0B0MEeacvQ6cODzg5Q,0.652173913043
1583,"I like the content covered in the lectures. That's very useful for me to clean data parsed from webpages. There is one thing I hope the course can improved, which probably has been mentioned in the forum for many times: the auto-grader is not flexible that it doesn't grant any points to answers that is slightly different from the submitted form (e.g. upper/lower cases, white space, etc.) and we have a hard time figuring out what exactly the auto-grader is accepting. I would suggest modifying the auto-grader such that it allows flexibility in answer acceptance, or breaking down questions into smaller parts (more partial credits) and give more precise/detailed description on the format of answer expected. ",RZ1S0B0MEeacvQ6cODzg5Q,0.513698630137
1584,"Really good course BUT be prepared for a very fast pace of the lectures. I'd placed in the advance beginner or intermediate low level, therefore, you need to have previous knowledge of Python. As in College, lectures and assignments are somewhat related, but you will spend some additional time investigating by yourself to get the appropriate responses. Again, just like College where Lectures are level 2-3 but assignments are level 7-8 (out of 10).",RZ1S0B0MEeacvQ6cODzg5Q,0.566666666667
1585,I thank so much professor Brooks and the team of the cours. ,RZ1S0B0MEeacvQ6cODzg5Q,0.692307692308
1586,"Awsome course with good balance betweern Challange,Reasearch and Progression.",RZ1S0B0MEeacvQ6cODzg5Q,0.5
1587,"Although the tests can be a bit fiddly, this is a great course if you already have a bit of background with Python and/or data cleaning. Lecture and tutorial videos are lean and information-dense. ",RZ1S0B0MEeacvQ6cODzg5Q,0.682926829268
1588,"Really awesome course. It is a kind of do it yourself course.The assignments are tough to crack. I think a little bit of programming experience is neccessary. The lectures themselves only give the basic knowledge. The assignments make you do research on the relevant topics. The autograder is pretty bad, it gives false negatives a lot of times, but that i believe is Coursera's drawback and they are working on it.",RZ1S0B0MEeacvQ6cODzg5Q,0.518072289157
1589,"Very challenging course. And I thought I knew Python. I learned much, much more about Pandas, idioms, lambdas, regex, etc. I will be able to be more productive at work with all this. Thanks.",RZ1S0B0MEeacvQ6cODzg5Q,0.5
1590,"Excellent course, I learned a lot especially through the assignments. Missing a fifth star because of a lot of issues with the notebooks autograding, and sometimes imprecise instructions in the assignments. Still I look forward to working on the next pandas courses!",RZ1S0B0MEeacvQ6cODzg5Q,0.553191489362
